theme_name,set_name,prod_long_desc,list_price,piece_count,ages,review_difficulty
Marvel Super Heroes,Corvus Glaive Thresher Attack,"Stage an awesome battle at the Wakandan wall with Vision, Shuri and Black Panther against Corvus Glaive and an Outrider with this LEGO® Marvel Super Heroes 76103 Corvus Glaive Thresher Attack set. The wall features a lever-operated opening gate, tower with rotating, dual stud-shooting turrets, hidden disc shooter, Wakandan lab with flip function and the Infinity Stone element. The bad guys are attacking with a Thresher launcher—hit the right spot on the wall with the Thresher to activate the lab’s flip function. This super hero toy also includes 5 minifigures.
Includes 5 minifigures: Vision, Shuri, Black Panther, Corvus Glaive and an Outrider.
Wakandan wall features a lever-operated opening gate, tower with 2 rotating, dual stud-shooting turrets, hidden disc shooter, hinged wall section, Wakandan lab with minifigure seat, desk and 2 computer screen elements, flip function and the Infinity Stone element.
Also includes a Thresher and Thresher launcher with trigger and jungle camouflage elements.
Aim the Thresher at the wall to activate the lab's flip function.
Weapons include Shuri’s 2 gauntlets and Corvus Glaive’s staff.
The new-for-March-2018 Outrider minifigure has 6 arms.
Attach multiple sets to each other to expand the Wakanda wall.
Recreate thrilling scenes from the Marvel Super Heroes Avengers: Infinity War movie.
Wakandan wall measures over 7” (20cm) high, 9” (25cm) wide and 3” (9cm) deep.
Thresher launcher measures over 1” (5cm) high, 3” (8cm) wide and 4” (12cm) deep.
Thresher measures over 2” (7cm) high, 2” (7cm) long and 1” (4cm) wide.",39.99,416.0,7-14,Average
Disney™,Sleeping Beauty's Fairytale Castle,"LEGO® l Disney Sleeping Beauty’s Fairytale Castle is easy to build and perfect for playing out favorite moments from Disney’s Sleeping Beauty. There’s a bedroom, spinning wheel, vanity and a special birthday cake. Maleficent’s lair adds drama and excitement to the role-play action. Get creative using the modular design of this fun toy to easily move and swap sections within the model, or rearrange the rooms of the castle and integrate them with other compatible LEGO l Disney toys to build your own dream creations. Includes 2 mini-doll figures plus Merryweather and bunny figures.
Includes Aurora and Maleficent mini-doll figures, plus a good fairy and a bunny figure.
Features a modular Fairytale Castle with a balcony, vanity and a bed with hidden storybook tile, plus Maleficent’s lair with throne.
Accessory elements include a magic wand, crown, spinning wheel, hair bow, flowers, cake, mixing bowl, scissors, hairbrush, perfume bottle, basket, carrot, cherries and Maleficent's staff.
Customize the set by easily swapping and rearranging internal features such as the spinning wheel, vanity and cake table.
Move and rearrange the rooms and Maleficent’s lair to create a new castle every time, or combine, swap and mix this model with other compatible LEGO® l Disney toys to build your own dream creations.
Recreate favorite moments from Disney's Sleeping Beauty with iconic details such as the spinning wheel, giant cake and birthday dress decoration.
Create your own stories about life in the castle with this fun toy, and discover a secret storybook tile under Aurora’s bed.
Suitable for ages 6-12.
Sleeping Beauty’s Fairytale Castle measures over 11” (29cm) high, 4” (12cm) wide and 2” (6cm) deep.
Maleficent’s lair measures over 4” (11cm) high, 2” (6cm) wide and 2” (6cm) deep.",39.99,322.0,5-12,Easy
Disney™,Cinderella's Enchanted Evening,"Reenact scenes from the iconic Disney movie, Cinderella, with this easy-to-build model. Play with Cinderella in her house with kitchen and upstairs sleeping area. Then change her into her ball gown and go to the ball in the carriage—and take off the roof for easy play inside with 2 seats for Cinderella and her Fairy Godmother. Includes 2 mini-doll figures, plus 2 figures: a horse and a mouse.
Includes 2 mini-doll figures from Disney’s Cinderella: Cinderella with switchable skirts and the Fairy Godmother, plus 2 animal figures: a horse and a mouse. • Features Cinderella’s Carriage, Cinderella’s house with 2 stories, and a revolving stand for her ball gown. • Cinderella’s Carriage sits 2 mini-doll figures and features a removable roof for easy play inside, opening door and an opening chest. • Cinderella’s house features an opening door and windows, downstairs kitchen area with sink and table, and a sleeping area upstairs. • Accessory elements include an invitation, 2 keys, magic wand, broom, hairbrush, scissors, plate with food and a piece of cheese. • Play and sing all day with Cinderella and her little mouse friend, as they do their chores around the house. • Help the Fairy Godmother transform Cinderella’s rags to a ball gown and show her around her amazing horse-drawn carriage. • Play out your favorite scenes from the movie or create new stories of your own with these much-loved characters. • Cinderella’s carriage measures over 4” (11cm) high, 9” (24cm) long and 2” (7cm) wide. • Cinderella’s house measures over 5” (14 cm) high, 4” (11cm) wide and 1” (5cm) deep.",39.99,350.0,5-12,Average
Disney™,Moana’s Ocean Voyage,"Discover the vibrant world of Disney’s Moana and join her on her epic adventure to bring back the heart of Te Fiti and restore harmony. This beautiful sailboat with opening storage under the deck, and island with transformation function, are perfect for recreating iconic scenes from the movie or creating new stories by the sea. Features a Moana mini-doll, Maui big figure, Heihei and two Kakamora.
Build Disney Princess Moana’s Ocean Voyage canoe with sail, opening deck, and a transforming Island of Te Fiti!
Featured in the award-winning Disney movie: Moana
Includes Moana mini-doll figure, Maui big figure, HeiHei the rooster, two buildable Kakamora pirates, plus a map, a catapult for the Kakamora, and the Heart of Te Fiti
LEGO Disney Princess building toys are compatible with all LEGO construction sets for creative building
Moana's boat measures over 6” high, 5” long and 5” wide, Island of Te Fiti measures over 4” high, 6” long and 1” deep
307 pieces – For boys and girls between the ages of 6 and 12 years old",39.99,307.0,5-12,Easy
Star Wars™,Moloch's Landspeeder™,"Recreate action-filled scenes from the Han Solo movie with this LEGO® Star Wars Moloch’s Landspeeder set. The infamous gang leader’s vehicle features an open minifigure cockpit, storage hold at the rear and hidden wheels for a cool hover effect. This Star Wars toy also has a 6-stud rapid shooter for intense action play, and an opening cage to hold the 2 Corellian Hound figures to add an extra dimension of battling fun for any LEGO Star Wars fan!
Includes Moloch and Rebolt minifigures, plus 2 Corellian Hound figures.
Features an open minifigure cockpit, opening cage for the hounds, rear storage hold, multi-stud shooter and hidden wheels for a hover effect.
Also includes Moloch’s blaster pistol and Rebolt's whip.
Play out epic Han Solo movie chase scenes with 75209 Han Solo's Landspeeder!
This LEGO® Star Wars toy is suitable for ages 8-12.
Measures over 2” (6cm) high, 6” (16cm) long and 4” (11cm) wide.",39.99,464.0,5-12,Easy
Marvel Super Heroes,Beware the Vulture,"Team up with Spider-Man and Iron Man to catch up with The Shocker’s Van and tackle the Vulture’s attacks in this thrilling LEGO® Marvel Super Heroes Beware the Vulture set. The Shocker’s Van opens up for easy play and includes a mounted, adjustable 6-stud rapid shooter, a buildable rifle and buildable tech egg, while Vulture’s wings have 2 detachable stud shooters. Includes 4 minifigures with assorted weapons and accessory elements such as Spider-Man’s firing Power Blasts.
Build an epic chase scene featuring Spiderman and Iron Man vs. The Vulture and The Shocker!
Featured in the sensational Marvel Studios film Spiderman: Homecoming
Includes minifigures of Spiderman and Iron Man with a van that opens, 6-stud rapid shooter and boosters for Iron Man’s feet and hands
LEGO Marvel Super Hero building toys are compatible with all LEGO construction sets for creative building
Van measures 2 inches high, 5 inches long, and 2 inches wide. The Vulture’s wingspan measures 2 inches high, 7 inches long, and 1 inch wide
375 pieces – for boys and girls between the ages of 7 and 14 years old",39.99,375.0,7-14,Average
Marvel Super Heroes,The Hulkbuster Smash-Up,"Overpower Proxima Midnight and the Outrider with Bruce Banner’s Hulkbuster in this LEGO® Marvel Super Heroes 76104 The Hulkbuster Smash-Up set. The posable Hulkbuster features an opening minifigure cockpit and bashing arm function. This action-packed set also includes a ball-shooting gun turret with an opening rear compartment containing the Infinity Stone element, Falcon's buildable wings with a detachable Redwing drone element and 4 minifigures.
Includes 4 minifigures: Bruce Banner, Falcon, Proxima Midnight and an Outrider.
Hulkbuster features an opening minifigure cockpit, wheel-operated bashing arm function and posable fingers, arms and legs.
Gun turret features a minifigure seat, ball shooter and an opening rear compartment containing the Infinity Stone element.
Includes Proxima Midnight's spear and Falcon's buildable wings with a detachable Redwing drone element.
The new-for-March-2018 Outrider minifigure has 6 arms.
Play out thrilling scenes inspired by the Marvel Super Heroes Avengers: Infinity War movie.
Hulkbuster measures over 5” (14cm) high, 2” (7cm) long and 6” (16cm) wide.
Gun turret measures over 3” (8cm) high, 4” (11cm) wide and 1” (5cm) deep..",29.99,375.0,7-14,Easy
Star Wars™,Yoda's Hut,"Reenact an iconic LEGO® Star Wars training scene at Yoda’s Hut on Dagobah. This feature-packed set includes Yoda’s swamp home with foldout training sections, from where Luke can balance boxes and stand on one arm to demonstrate his fledgling Jedi powers. There's also a Force jump function that can be attached to the front or back of the model. Jump Luke from the roof and swing from the ‘vine' with Yoda on his back. Inside, there's a folding bed, fireplace, a selection of food and furnishing elements, plus a secret compartment under the floor. There’s even a window at the side so R2-D2 can peer in! This feature-laden Star Wars toy includes 2 minifigures.
Includes Yoda and Luke Skywalker minifigures plus an R2-D2 figure.
Features foldout training sections, a detachable Force jump function, rooftop ‘vine’ swing function and a detailed interior including folding bed, fireplace, food and furnishing elements, and a secret underfloor compartment.
Carry Yoda on Luke's back as he trains.
Balance boxes, stand on one arm, pull a cool Force jump and swing from the ‘vine' like a true Jedi!
Weapons include Yoda's staff and Luke's Lightsaber.
Accessory elements include a carrot, frying pan, bottle and a snake.
This LEGO® Star Wars toy is suitable for ages 7-12.
Measures over 4” (11cm) high, 9” (25cm) long and 4” (11cm) wide.",29.99,229.0,5-12,Easy
Marvel Super Heroes,Ayesha's Revenge,"Stage a cosmic battle with this action-packed Guardians of the Galaxy set featuring Ayesha’s Golden Drone spaceship with two stud shooters, and Yondu’s Laser Drill spaceship with a spring-loaded missile, sliding minifigure cockpit and opening side panels. Includes three minifigures and a Groot figure in Ravager costume.
Build the battle on Ego’s planet between Ayesha’s golden drone and the Guardians of the Galaxy’s laser drill spaceship, with spring-launching missile, stud-shooters, and exploding cliff section!
Featured in Guardians of the Galaxy Vol. 2
Includes minifigures of Yondu, Star-Lord and Ayesha, plus Baby Groot figure with Ravager jacket decoration
LEGO Marvel Super Heroes building toys are compatible with all LEGO construction sets for creative building
Laser drill is 3” high, 6” long, and 2” wide. Golden drone is 1” high, 2” long, and 3” wide. Planet cliff section is 2” wide, 2” deep, and under 1” high
323 pieces – For boys and girls between the ages of 7 and 14 years old",29.99,323.0,7-14,Average
Star Wars™,Han Solo's Landspeeder™,"Recreate high-speed LEGO® Star Wars action scenes from the Han Solo movie with Han’s Landspeeder. Featuring an open 2-minifigure cockpit, opening hood with storage compartment, removable engine, rear storage compartment with secret cargo, hidden wheels for a hover effect and 2 spring-loaded shooters, this action-packed Star Wars toy also includes a Corellian Hound figure for Han and Qi'ra to battle.
Includes Han Solo and Qi’ra minifigures, plus a Corellian Hound figure.
Features an open 2-minifigure cockpit, opening hood with ammo and accessory storage, removable engine, rear storage compartment with secret cargo, hidden wheels for a hover effect, and 2 spring-loaded shooters.
Remove the engine for a much-needed overhaul.
Also includes 2 blaster pistols.
Play out epic Han Solo movie chase scenes with 75210 Moloch's Landspeeder!
This LEGO® Star Wars toy is suitable for ages 7-12.
Measures over 1” (5cm) high, 6” (16cm) long and 3” (10cm) wide.",29.99,345.0,5-12,Easy
Disney™,Ariel and the Magical Spell,"Slide back the glass door and step inside Disney Princess™ Ariel’s Cave. Swim over to Ursula’s grotto and place Ariel at the revolving stand to reveal her human legs. This set is easy to build and perfect for fans of Disney’s The Little Mermaid to reenact their favorite scenes or create new stories of their own. Includes 2 mini-doll figures plus a Flounder figure.
Build the LEGO Disney Ariel’s cave featuring a sliding door, a treasure chest, and even a hideout for Flounder!
Featured in the critically acclaimed Walt Disney Studio’s classic: The Little Mermaid
Includes Ariel with switchable mermaid tail or legs and Ursula mini-doll figures
LEGO Disney Princess building toys are compatible with all LEGO construction sets for creative building
Ariel’s cave measures 5 inches high, 5 inches wide and 3 inches deep. Ursula’s grotto measures 3 inches high, 3 inches wide and 3 inches deep.
222 pieces – For girls and boys between the ages of 5 and 12 years old",29.99,222.0,5-12,Average
Disney™,Anna & Kristoff’s Sleigh Adventure,"Enter the world of Disney Frozen on an exciting sleigh ride with Anna and Kristoff. Whether you're traveling through the snow or shopping for winter supplies at Wandering Oaken's Trading Post, Kristoff's sleigh allows you to reenact memorable scenes from the film and create new stories of your own. Includes Anna and Kristoff mini-doll figures plus Sven the reindeer.
LEGO Disney Frozen building toys are compatible with all LEGO construction sets for creative building
Sleigh measures over 2” high, 6” long and 2” wide. Wandering Oaken's Trading Post measures over 3” high, 3” wide and 1” deep. Barn fascia measures over 2” high, 3” wide and 1” deep.
174 pieces – For boys and girls between the ages of 5 and 12 years old",29.99,174.0,5-12,Easy
Marvel Super Heroes,Royal Talon Fighter Attack,"Help Black Panther and Nakia win the ultimate battle against super villain Killmonger and Ulysses Klaue, with this awesome LEGO® Marvel Super Heroes Royal Talon Fighter Attack set. The Royal Talon Fighter features an opening minifigure cockpit, 2 stud shooters and a rear prison compartment to trap a minifigure. The set also includes 4 minifigures with weapons to intensify the role-play conflict.
Includes 4 minifigures: Black Panther, Nakia, Killmonger and Ulysses Klaue.
The ancient mask-shaped Royal Talon Fighter features an opening minifigure cockpit, rear prison compartment to trap a minifigure and 2 stud shooters.
Weapons include Nakia's 2 disc blades, Killmonger's flick missile shooter and Ulysses Klaue's ultrasonic robotic hand.
Also includes Killmonger's mask element.
Recreate epic moments from the Marvel Super Heroes Black Panther movie.
Royal Talon Fighter measures over 2” (7cm) high, 8” (21cm) long and 6” (16cm) wide.",29.99,358.0,7-14,Average
Marvel Super Heroes,Iron Man: Detroit Steel Strikes,"Help Iron Man rescue Agent Coulson from Justin Hammer in his highly posable Detroit Steel weaponized mech with minifigure cockpit, arm-mounted chainsaw and 6-stud shooter. Agent Coulson’s classic car features foldable wheels for high-flying role-play adventures. Includes 3 minifigures.
Includes 3 minifigures: Invincible Iron Man, Agent Coulson and Justin Hammer.
Detroit Steel mech features a minifigure cockpit, fully posable legs, arms and hands, 2 movable wings, arm-mounted chainsaw and a 6-stud shooter.
Agent Coulson’s car Lola features 2 opening doors and folding wheels for flight mode.
Attach the Power Blast elements to Iron Man's hands, then push inwards to fire!
Fold Lola's wheels for flying mode and make a quick escape.
Weapons include Agent Coulson's gun and new-for-spring-2017 Power Blast weapons.
Also includes 3 translucent-blue thruster accessory elements.
This set offers an age-appropriate build and play experience for ages 7-14.
Detroit Steel stands over 5” (14cm) tall.
Lola measures over 1” (4cm) high, 5” (14cm) long and 2” (6cm) wide.",29.99,377.0,7-14,Easy
Marvel Super Heroes,Doctor Strange's Sanctum Sanctorum,"Stage a mysterious battle at Doctor Strange’s Sanctum Sanctorum, featuring a portal beast with moving tentacles, eyes and teeth. Use the levitating function levers to hover the Super Heroes around the house. Attach the cape of levitation to Doctor Strange and fly him towards the portal beast to use the mystical artifacts in battle. Trap a minifigure in the tentacles and stage a heroic rescue. Includes 3 minifigures.
Includes 3 minifigures: Doctor Strange, Karl Mordo and The Ancient One.
Doctor Strange's Sanctum Sanctorum features a portal beast with rotating teeth, moving eyes and tentacles that can trap minifigures, shelves for mystical artifact accessories, levitation effect for 2 minifigures, and levitation function for Doctor Strange's cloak.
Weapons include Karl Mordo's quarterstaff and The Ancient One's magical fans with eldritch calligraphy.
Accessory elements include Doctor Strange's cloak of levitation and magical power elements with eldritch calligraphy markings.
This set offers an age-appropriate building experience for ages 7-14.
Sanctum Sanctorum measures over 4” (11cm) high, 12” (31cm) wide and 7” (18cm) deep.",29.99,358.0,7-14,Average
Marvel Super Heroes,Tanker Truck Takedown,"Launch Captain America and Hawkeye against Spider-Man and Vision at the airport. Create an explosion effect by twisting the truck’s wheel cog to pop up the flames. Use the Super Jumper to launch Spider-Man at the burning truck and put out the fire, push the wind sock to trigger the exploding barrel function, and jump Hawkeye over the flame elements on his motorbike. Combine this set with 76051 Super Hero Airport Battle for an even bigger clash. Includes 4 minifigures.
Includes 4 minifigures: Captain America, Spider-Man, Hawkeye and Vision.
Features a tanker truck with detachable container and exploding function, wind sock with exploding barrels function and Hawkeye's motorbike.
Twist the tanker truck's wheel cog to open the fuel container and create an explosion effect with flames bursting out.
Activate the Super Jumper to launch Spider-Man at the exploding fuel container, or hit the wind sock to trigger the exploding barrel effect.
Also includes Hawkeye's bow and arrow element.
Accessory elements include Captain America's shield, Spider-Man's web blast, Vision's cape, 2 flames, fire extinguisher and a Super Jumper.
This set offers an age-appropriate building experience for ages 6-12.
Combine with 76051 Super Hero Airport Battle to stage an even bigger encounter.
Tanker truck measures over 2” (7cm) high, 9” (25cm) long and 2” (7cm) wide.
Motorbike measures over 2” (6cm) long, 1” (3cm) high and under 1” (2cm) wide.
Wind sock measures over 5” (14cm) high, 1” (3cm) wide and 1” (5cm) deep.",29.99,330.0,5-12,Easy
Star Wars™,Range Trooper™,"Take on any adversary with this highly posable LEGO® Star Wars Range Trooper buildable figure. This powerful character from the blockbuster Han Solo movie features tough armor and ‘magnetic boot’ detailing, furry shoulder cloak and tunic, as well as a blaster weapon with spring-loaded shooter. Star Wars fans will love battling with this cool LEGO buildable figure.
Highly posable Range Trooper buildable figure features tough armor and ‘magnetic boot’ detailing, furry shoulder cloak and tunic, plus a blaster weapon with spring-loaded shooter.
Engage the enemy with the powerful spring-loaded shooter.
Move the limbs into any battle pose.
Sturdy and durable design for intense action play.
Play out exciting adventures from the Han Solo movie.
This buildable figure is suitable for ages 8-14.
Stands over 9” (24cm) tall.",24.99,101.0,7-14,Easy
Disney™,Moana’s Island Adventure,"Explore the beautiful world of Disney’s Moana with Moana’s Island Adventure. Recreate memorable scenes from the movie as Moana learns about the legends of her ancestors, finds the heart of Te Fiti and plays the drums in the cave. Then create new adventures of your own, living out island life in and around her house with Pua her pet pig. Includes a Moana mini-doll, plus Pua the pig.
LEGO Disney Moana building toys are compatible with all LEGO construction sets for creative building
Moana’s house measures over 5” high, 9” wide and 3” deep. Cave area with waterfall measures over 3” high, 4” wide and 1” deep
205 pieces – For boys and girls between the ages of 5 and 12 years old",24.99,205.0,5-12,Challenging
Marvel Super Heroes,Captain America Jet Pursuit,"Ms. Marvel is on a mission to help retrieve Captain America’s shield from Super-Adaptoid, who is shooting back with his Power Blasts. Use her super-extending arms to attach her to the jet, which features movable wings for flying and attack modes, a minifigure cockpit with space for a shield, and dual disc shooters. Includes three minifigures.
Includes three minifigures: Pilot Captain America, Ms. Marvel and Super-Adaptoid.
Captain America's jet features sweep back wings, dual disc shooters and a minifigure cockpit with shield holder and Captain America logo.
Attach the Power Blast elements to Super-Adaptoid's hands, then push inwards to fire!
Extend Ms. Marvel's flexible arms on either side by sliding them through the super torso.
Push a trigger in the aircraft's tail forward to switch from flying mode into attack mode ,then fire the dual disc shooters at Super-Adaptoid.
Also includes new-for-spring-2017 Power Blast weapons.
Accessory elements include three translucent-blue thrusters, Captain America's shield, Super-Adaptoid's wings, Ms. Marvel's big hands and four shooting discs.
This set offers an age-appropriate build and play experience for ages 6-12.
Captain America's jet measures over 1” (5cm) high, 7” (20cm) long and 7” (18cm) wide with wings swept back.
Captain America's jet with wings extended measures over 1” (5cm) high, 7” (20cm) long and 7” (20cm) wide with wings swept forward.",19.99,160.0,5-12,Easy
Disney™,Palace Pets Royal Castle,"With LEGO® Disney Whisker Haven Tales with the Palace Pets™ you can play with and care for these beloved royal pets within the much-loved Disney Princess environment. Whisker Haven is a magical land where the pets can meet and play together. Build the Palace Pets Royal Castle with its golden roof and customizable towers, then throw a royal ball with your own touch of fairytale magic.
Includes Dreamy (Princess Aurora's cat) and Windflower (Pocahontas' raccoon).
Palace Pets Royal Castle features a 2-story building with a golden roof, 2 towers, dining area, music room, revolving dance floor and a garden lookout.
Prepare the castle for a grand ball and lay out the delicious cake.
Put on a show in the music room then party on the revolving dance floor!
Place each Palace Pet in its own special spot for a good night's sleep.
Palace Pets Royal Castle measures over 6” (16cm) high, 5” (13cm) wide and 5” (13cm) deep.
The towers of Palace Pets Royal Castle are interchangeable with special parts of 41069 Treasure's Day at the Pool, 41140 Daisy's Beauty Salon and 41141 Pumpkin's Royal Carriage for a customizable Palace Pets play experience.",19.99,186.0,5-12,Easy
