theme_name,set_name,prod_long_desc,list_price,piece_count,ages,review_difficulty
Marvel Super Heroes,ATM Heist Battle,"Help Spider-Man to stop the masked robbers burglarizing the bank in this action-packed LEGO® Marvel Super Heroes ATM Heist Battle set. The bank opens out for easy play and features an exploding window function, a removable ATM and an ATM with an explode function to send LEGO cash elements flying everywhere. The 2 robbers are equipped with a stud-shooting ATM Buster and a gun with hybrid-tech chain to drag the removable ATM away, plus a getaway bike. Attach and fire Spider-Man’s Power Blast weapons to take down the villains. Includes 3 minifigures.
Includes 3 minifigures: Spider-Man and 2 masked robbers.
The bank opens out for easy play and features an opening front door, exploding window function, 2 ATMs—one removable and one with cash-launching explode function and 6 LEGO® cash elements, connection points for Spider-Man to climb the walls, spider web and a fire hydrant outside.
Includes a getaway bike with a minifigure seat.
Also includes the robbers’ buildable hybrid-tech ATM Buster with stud-shooting function.
Weapons include Spider-Man’s 3 Power Blasts and the robbers’ gun with hybrid-tech chain to drag the ATM away.
Attach the Power Blast elements to Spider-Man’s hands and push inwards to fire!
The crook minifigures each have face mask decoration—of Hulk and Captain America.
Bank measures over 3” (9cm) high, 3” (9cm) wide and 3” (9cm) deep, and over 3” (9cm) high, 7” (19cm) wide and 1” (4cm) deep when opened out.
Getaway bike measures over 1” (3cm) high, 2” (6cm) long and under 1” (2cm) wide.",19.99,185.0,5-12,Easy
Marvel Super Heroes,Rhino Face-Off by the Mine,"Team up with Black Panther and Okoye in a Rhino Face-Off by the Mine against masked super villain Killmonger. This LEGO® Marvel Super Heroes set features a posable rhino figure with stud shooters and a rail track with moving mining cart. Tip the mining cart or activate the rail track's explode function to knock over the cart and spill the vibranium. This exciting set includes 3 minifigures.
Includes 3 minifigures: Black Panther, Okoye and Killmonger.
Rhino features a minifigure seat, posable head and legs, rhino horn elements and 2 stud shooters.
Mining cart features a tipping function and translucent-blue vibranium nugget elements.
Activate the rail track's explode function to knock over the cart.
Also includes Okoye's spear.
Recreate epic moments from the Marvel Super Heroes Black Panther movie.
Rhino measures over 3” (8cm) high, 5” (15cm) long and 2” (6cm) wide.
Mining cart measures over 1” (4cm) high, 3” (9cm) long and 1” (3cm) wide.
Rail track measures over 1” (3cm) high, 1” (4cm) wide and 7” (18cm) deep.",19.99,229.0,5-12,Easy
Marvel Super Heroes,Ravager Attack,"Stage a forest face-off between Taserface in his M-ship, featuring four stud shooters and a minifigure cockpit, and Rocket and Mantis, who are hiding in the forest setting featuring a buildable tree with branch elements. Help the two Guardians of the Galaxy build the six-stud shooter, then fire at the approaching M-ship and work as a team to fend off the Ravagers. Includes three minifigures.
Includes three minifigures: Mantis, Rocket and Taserface.
Features a forest setting with buildable tree and six-stud shooter, plus an M-ship with a minifigure cockpit and four stud shooters.
Weapons include Taserface’s big gun and Rocket’s two guns.
M-ship measures over 1” (5cm) high, 4” (11cm) long and 6” (17cm) wide.
Tree measures over 3” (8cm) high, 4” (12cm) wide and 3” (8cm) deep.",19.99,197.0,5-12,Easy
Disney™,Anna's Snow Adventure,"Enter the world of Disney Frozen and join Anna as she takes a break on her journey to visit her sister. With a feeding station for her horse and a campfire to make hot chocolate, they have everything they need to rest and refuel. The sleeping shelter has an opening function for easy play inside. Includes an Anna mini-doll, plus her horse.
Includes an Anna mini-doll figure in coronation outfit, plus her horse.
Features a shelter with an opening roof and a bed, a horse feeding station with hay bales to sit on, and a campfire.
Feed the horse, enjoy the campfire and make some hot chocolate.
Get a good night's sleep, then put the saddle on Anna's horse and continue your adventures!
Accessory elements include a map, chocolate and a cup.
This set offers an age-appropriate build and play experience for ages 5-12.
Shelter measures over 2” (7cm) high, 3” (10cm) wide and 3” (8cm) deep.
Horse feeding station measures over 3” (8cm) high, 3” (8cm) wide and 1” (3cm) deep.",19.99,153.0,5-12,Easy
Marvel Super Heroes,Thor's Weapon Quest,"Join Thor, Rocket and Groot on a thrilling Avengers mission with LEGO® Marvel Super Heroes 76102 Thor’s Weapon Quest. This super hero toy features an Escape Pod with an opening cockpit for 3 minifigures and 2 stud shooters, plus a space station with a cosmic power source, weapon and features, the Infinity Stone element and stand, 3 minifigures and 10 Power Burst elements.
Includes 3 minifigures: Thor, Rocket and Groot (new-for-March-2018 teenage version).
Escape Pod features an opening cockpit, detachable roof and 2 stud shooters.
Open the cockpit’s front and rear windshields and lift off the roof to place all 3 minfigures inside.
Space station features a cosmic power source, 2 energy coils, weapon reveal function, and the Infinity Stone element and stand.
Includes Rocket's gun and Groot's extended vine arm element.
Also includes 10 assorted translucent-blue Power Burst elements to customize your builds and minifigures.
Escape Pod can be connected to The Guardians’ Ship in 76107 Thanos: Ultimate Battle.
Recreate thrilling scenes from the Marvel Super Heroes Avengers: Infinity War movie.
Escape Pod measures over 2” (7cm) high, 5” (13cm) long and 4” (11cm) wide.
Space station measures over 1” (5cm) high, 2” (7cm) wide and 3” (8cm) deep.",19.99,223.0,5-12,Easy
Marvel Super Heroes,Outrider Dropship Attack,"Join Captain America and Black Widow’s battle to repel the Outriders and save Wakanda with this action-packed LEGO® Marvel Super Heroes 76101 Outrider Dropship Attack set!
Includes 4 minifigures: Captain America, Black Widow and 2 Outriders.
Dropship features an opening dual minifigure cockpit with the Infinity Stone element on a stand, foldout sides and 2 stud shooters.
Weapons include Captain America’s 2 Wakandan Shields and Black Widow's 2 batons.
The new-for-March-2018 Outrider minifigures each have 6 arms.
Recreate thrilling scenes from the Marvel Super Heroes Avengers: Infinity War movie.
Dropship measures over 4” (12cm) high, 2” (7cm) long and 2” (6cm) wide, and 1” (4cm) high, 7” (19cm) long and 9” (23cm) with sides folded out.",14.99,124.0,5-12,Easy
Star Wars™,Imperial Patrol Battle Pack,"Play out Imperial law-enforcing scenarios with this imposing LEGO® Star Wars Imperial Patrol Battle Pack. Featuring a speeder with stud shooters, an Emigration Officer, Recruitment Officer and 2 Imperial Patrol Troopers, this Star Wars toy has everything your budding Imperial officer needs to keep their Star Wars minifigure collection under control!
Includes 4 minifigures: an Imperial Recruitment Officer, Imperial Emigration Officer and 2 Imperial Patrol Troopers.
Features a speeder with a minifigure seat and 2 stud shooters.
Also includes 4 stud blasters for the minifigures.
This LEGO® Star Wars toy is suitable for ages 6-12.
Speeder measures over 1” (3cm) high, 5” (13cm) long and 1” (5cm) wide.",14.99,99.0,5-12,Easy
Star Wars™,Jedi™ and Clone Troopers™ Battle Pack,"Command your own LEGO® Star Wars Jedi & Clone Trooper squad with this fun battle pack, featuring 2 Lightsaber-wielding Jedi warriors, 2 Clone Troopers with stud blasters and a speeder with stud shooters and rotating wingtip guns.
Includes 4 minifigures: Ki-Adi Mundi, Barriss Offee and 2 Clone Troopers.
Features a speeder with opening canopy and space for a Clone Trooper inside, 2 stud shooters and rotating guns on the wingtips.
Weapons include 2 stud blasters for the Clone Troopers and 2 Lightsabers.
This LEGO® Star Wars toy is suitable for ages 6-12.
Speeder measures over 1” (5cm) high, 3” (10cm) long and 4” (12cm) wide.",14.99,102.0,5-12,Easy
Disney™,Mulan's Training Day,"LEGO® l Disney Mulan’s Training Day is easy to build and perfect for recreating favorite moments from the movie. Train hard using the turning training dummy, and sword and catapult with boulders, before taking a break with her foal, Khan. This LEGO® l Disney toy for girls and boys includes lots of beautiful and authentic details, including Mulan's yellow dress, her fan and a tea ceremony. Get creative using the modular design to easily move and swap sections within the model, or integrate the family temple with other compatible LEGO l Disney sets to build your own dream creations. Includes a mini-doll figure plus a horse figure.
Includes a Mulan mini-doll figure, plus Khan the horse figure.
Features a family temple, turning training dummy, catapult, tea ceremony and a cherry blossom tree.
Accessory elements include a sword, boulders, fan, teapot and a teacup.
Customize the set by easily swapping and rearranging internal features such as the tea ceremony, catapult and cherry blossom tree.
Combine, swap and mix this model with other compatible LEGO® l Disney toys to build your own dream creations.
Take aim at the training dummy with the catapult, and use the turn function to make it spin as Mulan practices her sword skills.
Help Mulan perform a tea ceremony and cool her down with the cute fan.
This toy for girls and boys is suitable for ages 5-12.
Family Temple measures over 4” (12cm) high, 2” (6cm) wide and 2” (6cm) deep.",14.99,104.0,5-12,Average
Marvel Super Heroes,Iron Man vs. Ultron,"Team up with Iron Man MK45 to take on the Ultron army in an ultimate battle! Defend against aerial attacks from the Ultron vehicle piloted by the Ultron Sentry Officer. Take cover as Ultron Sentries leap from the back of the vehicle and fire their stud shooters. Then activate Iron Man’s Super Jumper to topple the Ultron Sentry Officer and bring the vehicle crashing to the ground! Includes 4 minifigures with assorted weapons and accessories: Ultron Sentry Officer, 2 Ultron Sentries and Iron Man MK45.
Includes 4 minifigures with assorted weapons and accessories: Ultron Sentry Officer, 2 Ultron Sentries and Iron Man MK45
Ultron vehicle features 2 antennas, adjustable wings and attachment points for Ultron Sentries
Weapons include 2 stud shooters
Accessories include Iron Man’s iconic helmet, thrusters and Super Jumper (new for spring 2015), and the Ultron Sentries’ thrusters
Take on the Ultron army with Iron Man MK45
Dodge the Ultron Sentries’ stud shooters
Topple the Ultron SentryOfficer with super-jumping Iron Man!
Ultron vehicle measures over 5” (8cm) high, 3” (10cm) long and 3” (10cm) wide",12.99,92.0,5-12,Easy
Marvel Super Heroes,Mighty Micros: Spider-Man vs. Scorpion,"Role-play a daring duel between Spider-Man and his venomous enemy Scorpion. Scorpion’s Mighty Micros car features movable pincers and tail with sting, while Spider-Man’s blue and red buggy features exhaust pipes. The super villain also has a mini-scorpion to match Spider-Man’s mini-spider. Includes two minifigures with mini legs.
Includes Spider-Man and Scorpion minifigures with mini legs.
Move the tail and pincers of Scorpion’s Mighty Micros car and attack Spider-Man!
Scorpion’s Mighty Micros car features dual pincers and a tail with sting.
Accessory elements include a mini-scorpion and a mini-spider.
This set offers an age-appropriate build and play experience for ages 5-12.
Spider-Man's Mighty Micros car measures over 1” (3cm) high, 1” (5cm) long and 1” (4cm) wide.
Scorpion's Mighty Micros car withclaws retracted measures over 2” (6cm) high, 1” (5cm) long and 1” (5cm) wide.",9.99,79.0,5-12,Easy
Disney™,Castle Interior Kit,"Make your castle fit for a princess with this LEGO® l Disney Castle Interior Kit, featuring small, buildable castle furniture and household items, assorted decorative accessory elements, a fabric rug and blanket, plus decorative stickers. Rebuild the furniture to make alternative items using the pictures for inspiration. Use this kit to customize your LEGO® l Disney building toys and inspire even more role-play fun.
Features small, buildable castle furniture and household items, assorted decorative accessory elements, a fabric rug and blanket, plus a sheet of decorative stickers.
Rebuild the furniture to create alternative items.
Transform the interiors of your existing LEGO® l Disney models.
Combine with the 40388 Mini-Doll Dress-Up Kit to create even more play possibilities for your LEGO® l Disney sets.",9.99,115.0,6+,Easy
Disney™,Mini-Doll Dress-Up Kit,"Kit out your mini-doll figures in Disney Princess style with the LEGO® l Disney Mini-Doll Dress-Up Kit, featuring a buildable sewing machine, dressing table, vanity table with chair and a clothes rack, plus assorted accessory elements. Use this kit to customize your LEGO® l Disney sets and inspire even more role-play fun.
Features various small builds including a sewing studio with buildable sewing machine, dressing table, vanity table with chair, clothes rack, 4 fabric capes and a fabric skirt to fit a mini-doll (not included), plus assorted accessory elements.
The perfect addition to your LEGO® l Disney play sets.
Combine with the 40307 Castle Interior Kit to create even more play possibilities for your LEGO® l Disney sets.",9.99,80.0,6+,Easy
Marvel Super Heroes,Mighty Micros: Wolverine vs. Magneto,"Stage a mutant-powered battle between Wolverine and Magneto. Wolverine has long claws and a Mighty Micros jet featuring extendable wings to help him escape being pulled in by Magneto’s magnet-shaped car and magnetic powers. Includes 2 minifigures with mini legs.
Includes Wolverine and Magneto minifigures with mini legs.
Wolverine’s Mighty Micros jet features 4 movable wings.
Magneto’s Mighty Micros car features a classic magnet shape at the rear.
Use Wolverine’s claws to swipe at Magneto.
Accessory elements include Magneto's decorated-translucent magnetic power.
This set offers an age-appropriate build and play experience for ages 5-12.
Wolverine's Mighty Micros jet with wings folded in measures over 1” (3cm) high, 1” (5cm) long and 1” (4cm) wide.
Magneto’s Mighty Micros car measures over 1” (3cm) high, 1” (5cm) long and 1” (4cm) wide.",9.99,85.0,5-12,Easy
Marvel Super Heroes,Mighty Micros: Iron Man vs. Thanos,"Play out a fun Mighty Micros battle between two powerful rivals. Iron Man’s car features rear rocket thrusters for fast-play action and includes a wrench to dismantle his enemy’s car. Thanos’ Mighty Micros car features five Infinity gem elements and movable front fingers that resemble the Infinity Gauntlet. Includes two minifigures with mini legs.
Includes Iron Man and Thanos minifigures with mini legs.
Thanos’ Mighty Micros car features five movable fingers and five Infinity gem elements.
Iron Man’s Mighty Micros car features dual rear rocket thrusters.
Use Iron Man’s wrench to dismantle Thanos' Infinity Gauntlet-style car!
Accessory elements include Iron Man's wrench and boosters, and Thanos' Infinity Gauntlet.
This set offers an age-appropriate build and play experience for ages 5-12.
Iron Man's Mighty Micros car measures over 1” (3cm) high, 1” (5cm) long and 1” (4cm) wide.
Thanos’ Mighty Micros car measures over 1” (3cm) high, 1” (5cm) long and 1” (5cm) wide.",9.99,94.0,5-12,Easy
Marvel Super Heroes,Mighty Micros: Thor vs. Loki,"Stage a sibling showdown with this fun LEGO® Marvel Super Heroes Mighty Micros: Thor vs. Loki set, featuring Thor’s Mighty Micros car with adjustable wing elements and Loki’s Mighty Micros car with Viking horn elements. Loki is equipped with a scepter and Thor has his iconic Mjölnir hammer to add to the role-play action. This fun superhero toy for kids includes 2 minifigures with mini legs.
Includes Thor and Loki minifigures with mini legs.
Thor’s Mighty Micros car features 2 adjustable wing elements.
Loki’s Mighty Micros car features 2 silver-colored Viking horn elements.
Weapons include Thor’s Mjölnir hammer and Loki’s scepter.
Accessory elements includes Thor's cape and Loki's helmet.
Multiple Mighty Micros sets to collect, including 76089 Mighty Micros: Scarlet Spider vs. Sandman and 76090 Mighty Micros: Star-Lord vs. Nebula for even more battle fun.
This fun superhero toy for kids is suitable for ages 5-12.
Thor’s car measures over 1” (4cm) high, 2” (6cm) long and 2” (6cm) wide.
Loki’s car measures over 1” (5cm) high, 2” (6cm) long and 1” (4cm) wide.",9.99,79.0,5-12,Easy
